{
  "schema": "rusty.quest.sidecar.manifold_public_derivative_schema_slice_response_handoff_package.v1",
  "package_id": "package.manifold_public_derivative_schema_slice_response_handoff.synthetic.001",
  "generated_at": "2026-06-05T00:56:00Z",
  "package_status": "public_derivative_schema_slice_response_handoff_package_ready",
  "source_manifold_public_derivative_schema_slice_response_implementation_preflight": {
    "path": "fixtures/valid/manifold-public-derivative-schema-slice-response-implementation-preflight.synthetic.json",
    "schema": "rusty.quest.sidecar.manifold_public_derivative_schema_slice_response_implementation_preflight.v1",
    "preflight_id": "preflight.manifold_public_derivative_schema_slice_response_implementation.synthetic.001",
    "preflight_status": "ready_for_manifold_public_derivative_schema_slice_response_planning",
    "next_gate": "manifold_public_derivative_schema_slice_response_handoff_or_operator_decision"
  },
  "package_scope": {
    "package_class": "manifold_public_derivative_schema_slice_response_handoff_package",
    "source_mode": "synthetic_fixture",
    "target_repo": "rusty.manifold",
    "repo_touch_status": "not_touched",
    "branch_status": "not_created",
    "implementation_plan_status": "not_created",
    "implementation_status": "not_created",
    "response_status": "not_created",
    "decision_status": "not_decided",
    "schema_status": "not_created",
    "route_status": "not_created",
    "accepted_state_status": "not_created",
    "audit_record_status": "not_created",
    "validation_report_status": "not_created",
    "public_derivative_status": "not_created",
    "operator_approval_status": "not_recorded",
    "hostess_route_status": "not_created",
    "hostess_input_status": "not_created",
    "live_evidence_status": "not_included"
  },
  "authority": {
    "package_owner": "rusty.quest.sidecar_mesh",
    "handoff_acceptance_owner": "rusty.manifold",
    "implementation_plan_owner": "rusty.manifold",
    "response_owner": "rusty.manifold",
    "decision_owner": "rusty.manifold",
    "schema_owner": "rusty.manifold",
    "route_implementation_owner": "rusty.manifold",
    "request_acceptance_owner": "rusty.manifold",
    "runtime_authority_owner": "rusty.manifold",
    "session_authority_owner": "rusty.manifold",
    "audit_owner": "rusty.manifold.audit",
    "accepted_state_owner": "rusty.manifold",
    "rollback_owner": "rusty.manifold",
    "redaction_review_owner": "operator",
    "hostess_device_action_authority": "not_in_sidecar",
    "sidecar_role": "observer_proposer",
    "proposal_status": "not_accepted"
  },
  "handoff_manifest": {
    "manifest_id": "manifest.manifold_public_derivative_schema_slice_response_handoff.synthetic.001",
    "status": "candidate",
    "target_repo": "rusty.manifold",
    "source_chain_artifacts": [
      {
        "artifact_id": "artifact.public_lab_artifact_drift_review",
        "path": "fixtures/valid/public-lab-artifact-drift-review.synthetic.json",
        "schema": "rusty.quest.sidecar.public_lab_artifact_drift_review.v1",
        "role": "sanitized_public_lab_drift_evidence",
        "required_for_handoff": true
      },
      {
        "artifact_id": "artifact.no_network_prototype_handoff_review",
        "path": "fixtures/valid/no-network-prototype-handoff-review.synthetic.json",
        "schema": "rusty.quest.sidecar.no_network_prototype_handoff_review.v1",
        "role": "offline_agent_handoff_review",
        "required_for_handoff": true
      },
      {
        "artifact_id": "artifact.configured_peer_rehearsal_plan",
        "path": "fixtures/valid/configured-peer-rehearsal-plan.synthetic.json",
        "schema": "rusty.quest.sidecar.configured_peer_rehearsal_plan.v1",
        "role": "operator_approval_gated_peer_plan",
        "required_for_handoff": true
      },
      {
        "artifact_id": "artifact.manifold_adapter_contract_review",
        "path": "fixtures/valid/manifold-adapter-contract-review.synthetic.json",
        "schema": "rusty.quest.sidecar.manifold_adapter_contract_review.v1",
        "role": "future_manifold_adapter_contract_review",
        "required_for_handoff": true
      },
      {
        "artifact_id": "artifact.manifold_contract_intake_request",
        "path": "fixtures/valid/manifold-contract-intake-request.synthetic.json",
        "schema": "rusty.quest.sidecar.manifold_contract_intake_request.v1",
        "role": "future_manifold_contract_intake_request",
        "required_for_handoff": true
      },
      {
        "artifact_id": "artifact.private_rehearsal_approval_request",
        "path": "fixtures/valid/private-rehearsal-approval-request.synthetic.json",
        "schema": "rusty.quest.sidecar.private_rehearsal_approval_request.v1",
        "role": "operator_decision_packet",
        "required_for_handoff": true
      },
      {
        "artifact_id": "artifact.private_rehearsal_evidence_expectation",
        "path": "fixtures/valid/private-rehearsal-evidence-expectation.synthetic.json",
        "schema": "rusty.quest.sidecar.private_rehearsal_evidence_expectation.v1",
        "role": "future_private_evidence_expectation",
        "required_for_handoff": true
      },
      {
        "artifact_id": "artifact.private_rehearsal_public_derivative_expectation",
        "path": "fixtures/valid/private-rehearsal-public-derivative-expectation.synthetic.json",
        "schema": "rusty.quest.sidecar.private_rehearsal_public_derivative_expectation.v1",
        "role": "future_public_derivative_expectation",
        "required_for_handoff": true
      },
      {
        "artifact_id": "artifact.manifold_public_derivative_schema_request",
        "path": "fixtures/valid/manifold-public-derivative-schema-request.synthetic.json",
        "schema": "rusty.quest.sidecar.manifold_public_derivative_schema_request.v1",
        "role": "future_manifold_public_derivative_schema_request",
        "required_for_handoff": true
      },
      {
        "artifact_id": "artifact.manifold_public_derivative_schema_response_expectation",
        "path": "fixtures/valid/manifold-public-derivative-schema-response-expectation.synthetic.json",
        "schema": "rusty.quest.sidecar.manifold_public_derivative_schema_response_expectation.v1",
        "role": "future_manifold_public_derivative_schema_response_expectation",
        "required_for_handoff": true
      },
      {
        "artifact_id": "artifact.manifold_public_derivative_schema_implementation_preflight",
        "path": "fixtures/valid/manifold-public-derivative-schema-implementation-preflight.synthetic.json",
        "schema": "rusty.quest.sidecar.manifold_public_derivative_schema_implementation_preflight.v1",
        "role": "future_manifold_public_derivative_schema_implementation_preflight",
        "required_for_handoff": true
      },
      {
        "artifact_id": "artifact.manifold_public_derivative_schema_handoff_package",
        "path": "fixtures/valid/manifold-public-derivative-schema-handoff-package.synthetic.json",
        "schema": "rusty.quest.sidecar.manifold_public_derivative_schema_handoff_package.v1",
        "role": "future_manifold_public_derivative_schema_handoff_package",
        "required_for_handoff": true
      },
      {
        "artifact_id": "artifact.manifold_public_derivative_schema_slice_response_expectation",
        "path": "fixtures/valid/manifold-public-derivative-schema-slice-response-expectation.synthetic.json",
        "schema": "rusty.quest.sidecar.manifold_public_derivative_schema_slice_response_expectation.v1",
        "role": "future_manifold_public_derivative_schema_slice_response_expectation",
        "required_for_handoff": true
      },
      {
        "artifact_id": "artifact.manifold_public_derivative_schema_slice_response_implementation_preflight",
        "path": "fixtures/valid/manifold-public-derivative-schema-slice-response-implementation-preflight.synthetic.json",
        "schema": "rusty.quest.sidecar.manifold_public_derivative_schema_slice_response_implementation_preflight.v1",
        "role": "future_manifold_public_derivative_schema_slice_response_implementation_preflight",
        "required_for_handoff": true
      },
      {
        "artifact_id": "artifact.integration_acceptance_scorecard",
        "path": "fixtures/valid/integration-acceptance-scorecard.synthetic.json",
        "schema": "rusty.quest.sidecar.integration_acceptance_scorecard.v1",
        "role": "local_acceptance_summary",
        "required_for_handoff": true
      }
    ],
    "required_downstream_artifacts": [
      {
        "artifact_id": "artifact.public_derivative_schema_slice_response_schema",
        "artifact_kind": "response_schema",
        "owner": "rusty.manifold",
        "status": "not_created_by_sidecar",
        "evidence_source": "expected_manifold_slice_response.required_fields"
      },
      {
        "artifact_id": "artifact.public_derivative_schema_slice_decision_event_schema",
        "artifact_kind": "decision_event_schema",
        "owner": "rusty.manifold",
        "status": "not_created_by_sidecar",
        "evidence_source": "expected_manifold_slice_response.allowed_decisions"
      },
      {
        "artifact_id": "artifact.public_derivative_schema_slice_implementation_plan_descriptor",
        "artifact_kind": "implementation_plan_descriptor",
        "owner": "rusty.manifold",
        "status": "not_created_by_sidecar",
        "evidence_source": "expected_manifold_slice_response.implementation_plan_ref"
      },
      {
        "artifact_id": "artifact.public_derivative_schema_slice_accepted_source_chain_fixture",
        "artifact_kind": "accepted_source_chain_fixture",
        "owner": "rusty.manifold",
        "status": "not_created_by_sidecar",
        "evidence_source": "expected_manifold_slice_response.accepted_source_chain_ref"
      },
      {
        "artifact_id": "artifact.public_derivative_schema_slice_accepted_state_fixture",